{
  "$schema": "https://json-schema.org/draft/2020-12/schema",
  "type": "object",
  "additionalProperties": false,
  "required": ["schemaVersion", "baseSha", "headSha", "summary", "summaryEvidence", "affectedAreas", "chapters", "behavioralChanges", "risks", "facts", "inferences", "unknowns"],
  "properties": {
    "schemaVersion": {"type": "integer", "const": 1},
    "baseSha": {"type": "string"},
    "headSha": {"type": "string"},
    "summary": {"type": "string"},
    "summaryEvidence": {"type": "array", "items": {"$ref": "#/$defs/evidence"}},
    "affectedAreas": {"type": "array", "items": {"$ref": "#/$defs/affectedArea"}},
    "chapters": {"type": "array", "minItems": 1, "items": {"$ref": "#/$defs/chapter"}},
    "behavioralChanges": {"type": "array", "items": {"$ref": "#/$defs/behavior"}},
    "risks": {"type": "array", "items": {"$ref": "#/$defs/risk"}},
    "facts": {"type": "array", "items": {"$ref": "#/$defs/claim"}},
    "inferences": {"type": "array", "items": {"$ref": "#/$defs/claim"}},
    "unknowns": {"type": "array", "items": {"$ref": "#/$defs/claim"}}
  },
  "$defs": {
    "evidence": {
      "type": "object", "additionalProperties": false,
      "required": ["id", "path", "revision", "startLine", "endLine", "symbol"],
      "properties": {
        "id": {"type": "string"}, "path": {"type": "string"},
        "revision": {"type": "string", "enum": ["base", "head"]},
        "startLine": {"type": "integer", "minimum": 1}, "endLine": {"type": "integer", "minimum": 1},
        "symbol": {"type": "string"}
      }
    },
    "claim": {
      "type": "object", "additionalProperties": false, "required": ["id", "text", "evidence"],
      "properties": {"id": {"type": "string"}, "text": {"type": "string"}, "evidence": {"type": "array", "items": {"$ref": "#/$defs/evidence"}}}
    },
    "behavior": {
      "type": "object", "additionalProperties": false, "required": ["id", "summary", "before", "after", "evidence"],
      "properties": {"id": {"type": "string"}, "summary": {"type": "string"}, "before": {"type": "string"}, "after": {"type": "string"}, "evidence": {"type": "array", "items": {"$ref": "#/$defs/evidence"}}}
    },
    "risk": {
      "type": "object", "additionalProperties": false, "required": ["id", "title", "description", "level", "evidence"],
      "properties": {"id": {"type": "string"}, "title": {"type": "string"}, "description": {"type": "string"}, "level": {"type": "string", "enum": ["low", "medium", "high", "critical", "unknown"]}, "evidence": {"type": "array", "items": {"$ref": "#/$defs/evidence"}}}
    },
    "affectedArea": {
      "type": "object", "additionalProperties": false, "required": ["name", "description", "evidence"],
      "properties": {"name": {"type": "string"}, "description": {"type": "string"}, "evidence": {"type": "array", "items": {"$ref": "#/$defs/evidence"}}}
    },
    "file": {
      "type": "object", "additionalProperties": false, "required": ["path", "description"],
      "properties": {"path": {"type": "string"}, "description": {"type": "string"}}
    },
    "symbol": {
      "type": "object", "additionalProperties": false, "required": ["path", "name", "evidence"],
      "properties": {"path": {"type": "string"}, "name": {"type": "string"}, "evidence": {"type": "array", "items": {"$ref": "#/$defs/evidence"}}}
    },
    "test": {
      "type": "object", "additionalProperties": false, "required": ["id", "path", "description", "evidence"],
      "properties": {"id": {"type": "string"}, "path": {"type": "string"}, "description": {"type": "string"}, "evidence": {"type": "array", "items": {"$ref": "#/$defs/evidence"}}}
    },
    "question": {
      "type": "object", "additionalProperties": false, "required": ["id", "text", "rationale", "evidence"],
      "properties": {"id": {"type": "string"}, "text": {"type": "string"}, "rationale": {"type": "string"}, "evidence": {"type": "array", "items": {"$ref": "#/$defs/evidence"}}}
    },
    "chapter": {
      "type": "object", "additionalProperties": false,
      "required": ["id", "order", "title", "description", "purpose", "evidence", "files", "symbols", "behavioralChanges", "risks", "facts", "inferences", "unknowns", "relatedTests", "suggestedQuestions"],
      "properties": {
        "id": {"type": "string"}, "order": {"type": "integer"}, "title": {"type": "string"},
        "description": {"type": "string"}, "purpose": {"type": "string"},
        "evidence": {"type": "array", "items": {"$ref": "#/$defs/evidence"}},
        "files": {"type": "array", "items": {"$ref": "#/$defs/file"}},
        "symbols": {"type": "array", "items": {"$ref": "#/$defs/symbol"}},
        "behavioralChanges": {"type": "array", "items": {"$ref": "#/$defs/behavior"}},
        "risks": {"type": "array", "items": {"$ref": "#/$defs/risk"}},
        "facts": {"type": "array", "items": {"$ref": "#/$defs/claim"}},
        "inferences": {"type": "array", "items": {"$ref": "#/$defs/claim"}},
        "unknowns": {"type": "array", "items": {"$ref": "#/$defs/claim"}},
        "relatedTests": {"type": "array", "items": {"$ref": "#/$defs/test"}},
        "suggestedQuestions": {"type": "array", "items": {"$ref": "#/$defs/question"}}
      }
    }
  }
}
